{
    "run_id":  "20261014-163941-dc01-a",
    "class":  "attack",
    "host":  "DC01",
    "user":  "VTLAB\\admin01",
    "user_role":  "admin",
    "ttps":  [
                 "T1003.003"
             ],
    "steps":  [
                  {
                      "ttp":  "T1003.003",
                      "source":  "atomic:T1003.003/3",
                      "t0":  "2026-10-14T16:39:42.4247158Z",
                      "t1":  "2026-10-14T16:39:48.8469731Z",
                      "ok":  true
                  }
              ],
    "tempo":  "burst",
    "variant":  "mixed",
    "snapshot_before":  "DC01-CLEAN-ART",
    "exclude_pids":  [
                         6908
                     ],
    "tool_versions":  {
                          "powershell":  "5.1.20348.558"
                      },
    "t_start":  "2026-10-14T16:39:42.4091532Z",
    "t_end":  "2026-10-14T16:39:54.8624972Z"
}
