{
    "run_id":  "20261014-034548-win10-01-b",
    "class":  "benign",
    "host":  "WIN10-01",
    "user":  "VTLAB\\admin01",
    "user_role":  "admin",
    "ttps":  [

             ],
    "steps":  [
                  {
                      "ttp":  "",
                      "source":  "benign:log_review",
                      "t0":  "2026-10-14T03:45:48.7634648Z",
                      "t1":  "2026-10-14T03:45:48.8103322Z",
                      "ok":  true
                  },
                  {
                      "ttp":  "",
                      "source":  "benign:network_check",
                      "t0":  "2026-10-14T03:45:53.8109295Z",
                      "t1":  "2026-10-14T03:45:53.9195589Z",
                      "ok":  true
                  }
              ],
    "tempo":  "burst",
    "variant":  "mixed",
    "snapshot_before":  "",
    "exclude_pids":  [
                         6396
                     ],
    "tool_versions":  {
                          "powershell":  "5.1.19041.6456"
                      },
    "t_start":  "2026-10-14T03:45:48.7634648Z",
    "t_end":  "2026-10-14T03:45:58.9352902Z"
}
