{
    "run_id":  "20261014-081302-dc01-b",
    "class":  "benign",
    "host":  "DC01",
    "user":  "VTLAB\\admin01",
    "user_role":  "admin",
    "ttps":  [

             ],
    "steps":  [
                  {
                      "ttp":  "",
                      "source":  "benign:daily_work",
                      "t0":  "2026-10-14T08:13:02.2049677Z",
                      "t1":  "2026-10-14T08:13:02.2206603Z",
                      "ok":  true
                  }
              ],
    "tempo":  "burst",
    "variant":  "mixed",
    "snapshot_before":  "",
    "exclude_pids":  [
                         6136
                     ],
    "tool_versions":  {
                          "powershell":  "5.1.20348.558"
                      },
    "t_start":  "2026-10-14T08:13:02.2049677Z",
    "t_end":  "2026-10-14T08:13:10.2361206Z"
}
