{
    "run_id":  "20261014-134802-win10-01-a",
    "class":  "attack",
    "host":  "WIN10-01",
    "user":  "VTLAB\\admin01",
    "user_role":  "admin",
    "ttps":  [
                 "T1654",
                 "T1018",
                 "T1087.002"
             ],
    "steps":  [
                  {
                      "ttp":  "T1654",
                      "source":  "atomic:T1654/2",
                      "t0":  "2026-10-14T13:48:02.5319588Z",
                      "t1":  "2026-10-14T13:48:03.0162895Z",
                      "ok":  true
                  },
                  {
                      "ttp":  "T1018",
                      "source":  "atomic:T1018/3",
                      "t0":  "2026-10-14T13:50:12.0326464Z",
                      "t1":  "2026-10-14T13:50:12.8916945Z",
                      "ok":  true
                  },
                  {
                      "ttp":  "T1087.002",
                      "source":  "atomic:T1087.002/9",
                      "t0":  "2026-10-14T13:52:41.8920096Z",
                      "t1":  "2026-10-14T13:52:42.8759269Z",
                      "ok":  true
                  }
              ],
    "tempo":  "low_and_slow",
    "variant":  "cmd",
    "snapshot_before":  "",
    "exclude_pids":  [
                         3720
                     ],
    "tool_versions":  {
                          "powershell":  "5.1.19041.6456"
                      },
    "t_start":  "2026-10-14T13:48:02.5319588Z",
    "t_end":  "2026-10-14T13:56:22.8764244Z"
}
