{
    "run_id":  "20261014-135207-win10-01-a",
    "class":  "attack",
    "host":  "WIN10-01",
    "user":  "VTLAB\\user01",
    "user_role":  "standard",
    "ttps":  [
                 "T1016",
                 "T1087.002",
                 "T1018"
             ],
    "steps":  [
                  {
                      "ttp":  "T1016",
                      "source":  "atomic:T1016/1",
                      "t0":  "2026-10-14T13:52:07.0322991Z",
                      "t1":  "2026-10-14T13:52:08.0632752Z",
                      "ok":  true
                  },
                  {
                      "ttp":  "T1087.002",
                      "source":  "atomic:T1087.002/1",
                      "t0":  "2026-10-14T13:52:12.0638692Z",
                      "t1":  "2026-10-14T13:52:13.2196076Z",
                      "ok":  true
                  },
                  {
                      "ttp":  "T1018",
                      "source":  "atomic:T1018/3",
                      "t0":  "2026-10-14T13:52:18.2201647Z",
                      "t1":  "2026-10-14T13:52:19.2195409Z",
                      "ok":  true
                  }
              ],
    "tempo":  "burst",
    "variant":  "mixed",
    "snapshot_before":  "",
    "exclude_pids":  [
                         6080
                     ],
    "tool_versions":  {
                          "powershell":  "5.1.19041.6456"
                      },
    "t_start":  "2026-10-14T13:52:07.0322991Z",
    "t_end":  "2026-10-14T13:52:24.2201356Z"
}
