{
    "run_id":  "20261014-101650-win10-01-a",
    "class":  "attack",
    "host":  "WIN10-01",
    "user":  "VTLAB\\admin01",
    "user_role":  "admin",
    "ttps":  [
                 "T1016",
                 "T1654"
             ],
    "steps":  [
                  {
                      "ttp":  "T1016",
                      "source":  "atomic:T1016/1",
                      "t0":  "2026-10-14T10:16:50.7808939Z",
                      "t1":  "2026-10-14T10:16:51.8119299Z",
                      "ok":  true
                  },
                  {
                      "ttp":  "T1654",
                      "source":  "atomic:T1654/2",
                      "t0":  "2026-10-14T10:19:58.8120038Z",
                      "t1":  "2026-10-14T10:19:59.2654219Z",
                      "ok":  true
                  }
              ],
    "tempo":  "low_and_slow",
    "variant":  "powershell",
    "snapshot_before":  "",
    "exclude_pids":  [
                         3720
                     ],
    "tool_versions":  {
                          "powershell":  "5.1.19041.6456"
                      },
    "t_start":  "2026-10-14T10:16:50.7808939Z",
    "t_end":  "2026-10-14T10:23:32.2809365Z"
}
