{
    "run_id":  "20261014-081439-dc01-a",
    "class":  "attack",
    "host":  "DC01",
    "user":  "VTLAB\\admin01",
    "user_role":  "admin",
    "ttps":  [
                 "T1654"
             ],
    "steps":  [
                  {
                      "ttp":  "T1654",
                      "source":  "atomic:T1654/1",
                      "t0":  "2026-10-14T08:14:39.2368273Z",
                      "t1":  "2026-10-14T08:14:47.2367620Z",
                      "ok":  true
                  }
              ],
    "tempo":  "low_and_slow",
    "variant":  "wmic",
    "snapshot_before":  "",
    "exclude_pids":  [
                         6136
                     ],
    "tool_versions":  {
                          "powershell":  "5.1.20348.558"
                      },
    "t_start":  "2026-10-14T08:14:39.2368273Z",
    "t_end":  "2026-10-14T08:16:19.2516943Z"
}
