{
    "run_id":  "20261014-120736-dc01-a",
    "class":  "attack",
    "host":  "DC01",
    "user":  "VTLAB\\admin01",
    "user_role":  "admin",
    "ttps":  [
                 "T1087.002",
                 "T1654"
             ],
    "steps":  [
                  {
                      "ttp":  "T1087.002",
                      "source":  "atomic:T1087.002/12",
                      "t0":  "2026-10-14T12:07:36.7305041Z",
                      "t1":  "2026-10-14T12:07:37.8236236Z",
                      "ok":  true
                  },
                  {
                      "ttp":  "T1654",
                      "source":  "atomic:T1654/1",
                      "t0":  "2026-10-14T12:07:43.8242290Z",
                      "t1":  "2026-10-14T12:07:52.7611374Z",
                      "ok":  true
                  }
              ],
    "tempo":  "burst",
    "variant":  "wmic",
    "snapshot_before":  "",
    "exclude_pids":  [
                         6136
                     ],
    "tool_versions":  {
                          "powershell":  "5.1.20348.558"
                      },
    "t_start":  "2026-10-14T12:07:36.7305041Z",
    "t_end":  "2026-10-14T12:07:56.7617311Z"
}
