{
    "run_id":  "20261015-071753-dc01-h",
    "class":  "hard_negative",
    "host":  "DC01",
    "user":  "VTLAB\\admin01",
    "user_role":  "admin",
    "ttps":  [

             ],
    "steps":  [
                  {
                      "ttp":  "",
                      "source":  "benign:dc_backup_check",
                      "t0":  "2026-10-15T07:17:53.2587653Z",
                      "t1":  "2026-10-15T07:17:53.3054305Z",
                      "ok":  true
                  },
                  {
                      "ttp":  "",
                      "source":  "benign:admin_net_sweep",
                      "t0":  "2026-10-15T07:18:01.3057712Z",
                      "t1":  "2026-10-15T07:18:20.0707132Z",
                      "ok":  false
                  }
              ],
    "tempo":  "burst",
    "variant":  "mixed",
    "snapshot_before":  "",
    "exclude_pids":  [
                         6496
                     ],
    "tool_versions":  {
                          "powershell":  "5.1.20348.558"
                      },
    "t_start":  "2026-10-15T07:17:53.2587653Z",
    "t_end":  "2026-10-15T07:18:24.0709744Z"
}
