{
    "run_id":  "20261014-094227-win10-01-b",
    "class":  "benign",
    "host":  "WIN10-01",
    "user":  "VTLAB\\user01",
    "user_role":  "standard",
    "ttps":  [

             ],
    "steps":  [
                  {
                      "ttp":  "",
                      "source":  "benign:network_check",
                      "t0":  "2026-10-14T09:42:27.0464907Z",
                      "t1":  "2026-10-14T09:42:27.6714249Z",
                      "ok":  true
                  }
              ],
    "tempo":  "low_and_slow",
    "variant":  "mixed",
    "snapshot_before":  "",
    "exclude_pids":  [
                         6080
                     ],
    "tool_versions":  {
                          "powershell":  "5.1.19041.6456"
                      },
    "t_start":  "2026-10-14T09:42:27.0308550Z",
    "t_end":  "2026-10-14T09:43:19.6719286Z"
}
