{
    "run_id":  "20261014-120322-win10-01-b",
    "class":  "benign",
    "host":  "WIN10-01",
    "user":  "VTLAB\\user01",
    "user_role":  "standard",
    "ttps":  [

             ],
    "steps":  [
                  {
                      "ttp":  "",
                      "source":  "benign:daily_work",
                      "t0":  "2026-10-14T12:03:22.0840173Z",
                      "t1":  "2026-10-14T12:03:22.1464247Z",
                      "ok":  true
                  }
              ],
    "tempo":  "burst",
    "variant":  "mixed",
    "snapshot_before":  "",
    "exclude_pids":  [
                         6080
                     ],
    "tool_versions":  {
                          "powershell":  "5.1.19041.6456"
                      },
    "t_start":  "2026-10-14T12:03:22.0840173Z",
    "t_end":  "2026-10-14T12:03:28.1628609Z"
}
