{
    "run_id":  "20261015-125317-dc01-h",
    "class":  "hard_negative",
    "host":  "DC01",
    "user":  "VTLAB\\admin01",
    "user_role":  "admin",
    "ttps":  [

             ],
    "steps":  [
                  {
                      "ttp":  "",
                      "source":  "benign:dc_db_maint",
                      "t0":  "2026-10-15T12:53:17.3031703Z",
                      "t1":  "2026-10-15T12:53:29.9602822Z",
                      "ok":  true
                  }
              ],
    "tempo":  "burst",
    "variant":  "mixed",
    "snapshot_before":  "DC01-CLEAN-ART",
    "exclude_pids":  [
                         5268
                     ],
    "tool_versions":  {
                          "powershell":  "5.1.20348.558"
                      },
    "t_start":  "2026-10-15T12:53:17.2874448Z",
    "t_end":  "2026-10-15T12:53:32.9607130Z"
}
