{
    "run_id":  "20261014-033025-win10-01-b",
    "class":  "benign",
    "host":  "WIN10-01",
    "user":  "VTLAB\\admin01",
    "user_role":  "admin",
    "ttps":  [

             ],
    "steps":  [
                  {
                      "ttp":  "",
                      "source":  "benign:user_inventory",
                      "t0":  "2026-10-14T03:30:25.2356668Z",
                      "t1":  "2026-10-14T03:30:25.4860207Z",
                      "ok":  true
                  },
                  {
                      "ttp":  "",
                      "source":  "benign:log_review",
                      "t0":  "2026-10-14T03:31:43.6968538Z",
                      "t1":  "2026-10-14T03:31:43.7903070Z",
                      "ok":  true
                  }
              ],
    "tempo":  "low_and_slow",
    "variant":  "mixed",
    "snapshot_before":  "",
    "exclude_pids":  [
                         6396
                     ],
    "tool_versions":  {
                          "powershell":  "5.1.19041.6456"
                      },
    "t_start":  "2026-10-14T03:30:25.2356668Z",
    "t_end":  "2026-10-14T03:35:14.8434187Z"
}
