{
    "run_id":  "20261014-124442-dc01-a",
    "class":  "attack",
    "host":  "DC01",
    "user":  "VTLAB\\admin01",
    "user_role":  "admin",
    "ttps":  [
                 "T1016",
                 "T1087.002",
                 "T1018",
                 "T1654"
             ],
    "steps":  [
                  {
                      "ttp":  "T1016",
                      "source":  "atomic:T1016/9",
                      "t0":  "2026-10-14T12:44:42.5111012Z",
                      "t1":  "2026-10-14T12:45:03.1513891Z",
                      "ok":  true
                  },
                  {
                      "ttp":  "T1087.002",
                      "source":  "atomic:T1087.002/9",
                      "t0":  "2026-10-14T12:48:00.1518184Z",
                      "t1":  "2026-10-14T12:48:00.9950964Z",
                      "ok":  true
                  },
                  {
                      "ttp":  "T1018",
                      "source":  "atomic:T1018/3",
                      "t0":  "2026-10-14T12:50:52.9955618Z",
                      "t1":  "2026-10-14T12:50:53.7762921Z",
                      "ok":  true
                  },
                  {
                      "ttp":  "T1654",
                      "source":  "atomic:T1654/2",
                      "t0":  "2026-10-14T12:53:14.7763121Z",
                      "t1":  "2026-10-14T12:53:15.1982002Z",
                      "ok":  true
                  }
              ],
    "tempo":  "low_and_slow",
    "variant":  "wmic",
    "snapshot_before":  "",
    "exclude_pids":  [
                         6136
                     ],
    "tool_versions":  {
                          "powershell":  "5.1.20348.558"
                      },
    "t_start":  "2026-10-14T12:44:42.5111012Z",
    "t_end":  "2026-10-14T12:56:59.1985084Z"
}
