{
    "run_id":  "20261014-141630-win10-01-a",
    "class":  "attack",
    "host":  "WIN10-01",
    "user":  "VTLAB\\user01",
    "user_role":  "standard",
    "ttps":  [
                 "T1087.002",
                 "T1016",
                 "T1018"
             ],
    "steps":  [
                  {
                      "ttp":  "T1087.002",
                      "source":  "atomic:T1087.002/12",
                      "t0":  "2026-10-14T14:16:30.7974925Z",
                      "t1":  "2026-10-14T14:16:32.2353438Z",
                      "ok":  true
                  },
                  {
                      "ttp":  "T1016",
                      "source":  "atomic:T1016/9",
                      "t0":  "2026-10-14T14:19:08.2511225Z",
                      "t1":  "2026-10-14T14:19:19.4381504Z",
                      "ok":  true
                  },
                  {
                      "ttp":  "T1018",
                      "source":  "atomic:T1018/5",
                      "t0":  "2026-10-14T14:21:24.4381818Z",
                      "t1":  "2026-10-14T14:21:25.5633395Z",
                      "ok":  true
                  }
              ],
    "tempo":  "low_and_slow",
    "variant":  "cmd",
    "snapshot_before":  "",
    "exclude_pids":  [
                         6080
                     ],
    "tool_versions":  {
                          "powershell":  "5.1.19041.6456"
                      },
    "t_start":  "2026-10-14T14:16:30.7974925Z",
    "t_end":  "2026-10-14T14:23:35.5637389Z"
}
