{
    "run_id":  "20261015-071352-win10-01-h",
    "class":  "hard_negative",
    "host":  "WIN10-01",
    "user":  "VTLAB\\admin01",
    "user_role":  "admin",
    "ttps":  [

             ],
    "steps":  [
                  {
                      "ttp":  "",
                      "source":  "benign:network_check",
                      "t0":  "2026-10-15T07:13:52.8866740Z",
                      "t1":  "2026-10-15T07:13:52.9953823Z",
                      "ok":  true
                  },
                  {
                      "ttp":  "",
                      "source":  "benign:admin_net_sweep",
                      "t0":  "2026-10-15T07:13:59.0421694Z",
                      "t1":  "2026-10-15T07:14:18.6828426Z",
                      "ok":  true
                  }
              ],
    "tempo":  "burst",
    "variant":  "mixed",
    "snapshot_before":  "",
    "exclude_pids":  [
                         4712
                     ],
    "tool_versions":  {
                          "powershell":  "5.1.19041.6456"
                      },
    "t_start":  "2026-10-15T07:13:52.8866740Z",
    "t_end":  "2026-10-15T07:14:23.6833005Z"
}
