{
    "run_id":  "20261014-101512-win10-01-h",
    "class":  "hard_negative",
    "host":  "WIN10-01",
    "user":  "VTLAB\\user01",
    "user_role":  "standard",
    "ttps":  [

             ],
    "steps":  [
                  {
                      "ttp":  "",
                      "source":  "benign:network_check",
                      "t0":  "2026-10-14T10:15:12.4058197Z",
                      "t1":  "2026-10-14T10:15:12.5309567Z",
                      "ok":  true
                  }
              ],
    "tempo":  "burst",
    "variant":  "mixed",
    "snapshot_before":  "",
    "exclude_pids":  [
                         6080
                     ],
    "tool_versions":  {
                          "powershell":  "5.1.19041.6456"
                      },
    "t_start":  "2026-10-14T10:15:12.4058197Z",
    "t_end":  "2026-10-14T10:15:22.5465346Z"
}
