{
    "run_id":  "20261014-055553-win10-01-a",
    "class":  "attack",
    "host":  "WIN10-01",
    "user":  "VTLAB\\user01",
    "user_role":  "standard",
    "ttps":  [
                 "T1087.002"
             ],
    "steps":  [
                  {
                      "ttp":  "T1087.002",
                      "source":  "atomic:T1087.002/12",
                      "t0":  "2026-10-14T05:55:53.3428925Z",
                      "t1":  "2026-10-14T05:55:54.7021224Z",
                      "ok":  true
                  }
              ],
    "tempo":  "burst",
    "variant":  "cmd",
    "snapshot_before":  "",
    "exclude_pids":  [
                         6920
                     ],
    "tool_versions":  {
                          "powershell":  "5.1.19041.6456"
                      },
    "t_start":  "2026-10-14T05:55:53.3428925Z",
    "t_end":  "2026-10-14T05:56:00.7026655Z"
}
